Jasmine flower,Jasminum,,,,Dried botanical,Active botanicals,Accepted,,,,,,,,,,,,,,,,,,,,,,,,,,,,,,,,,,,,,,,❌,,,,,,,,,,,,,,,2017-08-20 12.12.07.jpg (https://v5.airtableusercontent.com/v3/u/28/28/1713765600000/0MYl6_9x9x6h_EyvsOF3qQ/hQofGdXjk2Gzqy_Te8EYG5F1TsQyik6wfPpzXtYuOPgA7ZLa9Y3LbR7fclRyDGsv2RkkvXzginPRuWRGQcDeTk7Dcm5uF_KlxbYZTtsExHQ/njNmHMCaCfOqrnWaIq-b0Ru2IDgLV6HWfvn1FaQx5_c),,,,,"Jasmine flower is believed to have antibacterial, anti-asthmatic, and anti-cancer activity.  The Chinese medicine use this herb to improve blood circulation, nourish spleen and stomach, lower blood pressure, and strengthen cardiovascular system.  The herb can be used together with rose, mint, chamomile, rosemary, marigold, and osmanthus flower.

Benefits to the Skin

Jasmine is rich in a variety of active chemical components that are beneficial to the skin.

Anti-aging: Because of its antioxidants, jasmine can help protect from environmental stressors. This can help give a youthful appearance to your skin.

Even skin tone: Jasmine can help. The oil is very effective in evening the tone of skin as well as reducing the appearance of age spots.

Moisturizing: Like many natural oils, jasmine oil helps treat dry skin and provide natural moisture that won’t clog pores.

Non-irritating: Jasmine Sambac, a variety from Hawaii, is perfect for those with finicky skin temperaments, as it’s non-irritating and non-sensitizing. It’s also great for dry, greasy, or sensitive skin, as it helps to balance all types without irritating.

Natural scent: We can’t deny the lovely scent that this flower has—so adding it to skin care helps to pick you up as well as nourish your skin.

-----
Skin Benefits of Arabian Jasmine

Who doesn’t want to have a skin that is beautiful, glowing and flawless?I bet you have tried every product out there in the market only to regret later that you spent a fortune on cosmetics that didn’t work. Why don’t to switch to a natural ingredient for a change? Yes, Arabian Jasmine, it is! But always blend jasmine with other carrier oils. Although Jasmine is safe, it’s advisable to use it after mixing it with avocado, sweet almond, jojoba, or coconut oil.

1. Natural Deodorant

By now it’s common knowledge that even the most pricey deodorants in the market won’t last beyond a period. Try Jasmine, will you?

Why Does It Work

The flower as well as the essential oil has ketone in low concentrations. This, in turn, gives it a warm, yet mild fragrance that makes it a natural deodorant option (1).

Back To TOC

2. Softer Skin

Longing to have a soft and smooth skin?

Add a few drops of the oil extracted from jasmine to your bath water. Soak yourself for 10 minutes for an in-bath moisturizer, and see the results for yourself. Or, you can mix jasmine oil with a little aloe vera lotion and apply it on your skin and leave on for a moisturized, soft skin (2). Believe me; you will feel just wow after a bath!

Back To TOC

3. Toned, Scar-free Skin

Crushed jasmine flowers or jasmine oil, when used along with petroleum jelly or coconut oil, helps to ease stretch marks and scars. It also tones and soothes dry skin and retains the skin’s elasticity (3).

Back To TOC

4. Eases Skin Troubles

Jasmine, when used as a tea, is known to be an effective cure for scratches, wounds, and cuts (4). It is also an effective home remedy for rashes and redness caused by sunburn. Jasmine juice is an effective cure for corns too.

Back To TOC

5. Safeguards Skin

You already know that the essential oil extracted from Jasmine can keep your skin moisturized and hydrated. Did you know that it can also heal the post acne marks? This way it can protect your skin from the cruelties of the weather too.

Back To TOC

Why Does It Work

The antibacterial, antiseptic, and antiviral properties of jasmine can be utilized in the form of its oil to improve the immunity power of the skin (5). Regular application of this oil on your skin can fight infections and weather impacts.

Hair Benefits Of Arabian Jasmine

Arabian jasmine offers a whole lot of benefits to the hair too. Here’s how.

6. Natural Conditioner

Aromatic Jasmine serves as an easy and perfect natural conditioner as well.

What You Need To Do

Prepare jasmine water by steeping 10 to 15 jasmine flowers in plain water. Allow it to cool down and use it as the last hair rinse. It can be mixed with baking soda to be used as shampoo as well as a conditioner. Jasmine water can also be used as a serum to keep your hair conditioned. Jasmine, in the form of oil, can be applied to keep frizzy, curly, and unmanageable hair under control by padlocking the moisture (6).

Back To TOC

7. For Stronger, Longer, And Radiant Locks

The extract of jasmine leaves strengthens your hair roots, makes hair tensile and prevents it from turning brittle. This also ensures that your strands grow longer and thicker. Fresh extract of jasmine infused with coconut hair oil also gives you longer, fuller hair. Along with maintaining its natural color and sheen, this extract also ensures that you own thicker locks (7).

Back To TOC

8. Anti-lice Agent

Are lice and bugs making your scalp itchy and irritating? Add a handful of jasmine flowers to a carrier oil (coconut, almond or any other of your choice) and apply it regularly on scalp and hair to shield your hair from the attacks of head lice.

Back To TOC

9. Keeps The Scalp Moisturized

Jasmine extracts when used along with coconut oil, almond oil, or jojoba oil is known to lock the moisture in the scalp, keeping the scalp hydrated while preventing hair fall and dandruff. So, say bye-bye to dry and itchy scalp with Jasmine (8).

Back To TOC

10. Treats Scalp Infections

Come monsoon and bacterial-fungal infections attack your scalp. If you are looking for an easy remedy, jasmine can help.

What You Need To Do

Crush jasmine flower and steep it in coconut oil. Apply this on your infected scalp to treat an infection. The antiseptic and anti-microbial actions of both the ingredients work together, thereby ensuring that the infection subsides at a faster pace (9).

Back To TOC

Health Benefits Of Arabian Jasmine

Last on the list is the sub-section about health benefits that is the most critical portion of this article (I’m sure many of you agree with me!). So, let’s go through the most important ones.

11. Natural Aphrodisiac

Jasmine has been used to enhance libido since time immemorial. Why not make use of it then?

Why Does It Work

These white flowers have this compelling masculine and sensual fragrance, which bestow them with their magical aphrodisiac powers. It relaxes the person completely, unlocking the sexual inhibitions. It prepares the man and the woman to express themselves while nurturing the reproductive system by triggering the secretion of essential sex hormones (10).

Back To TOC

12. Eases Stress And Depression

The fragrant and lively jasmine flowers are known to lift your mood and ease stress. Jasmine can also bring you out of depression.

What You Need To Do

Smell a handful of fresh jasmine buds to counter your stress levels. Alternatively, you can use the pure oil extracted from these leaves. The aromatic ingredients of the flower soothe the senses thwarts off negative thoughts and fill you with energy. Just 2 drops—that is what you need to beat the stress caused by work and exam, fatigue, nervousness, anxiety, tension, and even addiction.

While jasmine can ease postnatal depression too, make sure you use the oil instead of flowers for that benefit. Or, add about 10 to 12 jasmine flowers to your water and take a bath to boost your confidence levels, and put your emotions at ease.

Why Does It Work

Jasmine soothes the nerves by relaxing the automatic nerve activity and decreasing your heart rate. It is full of flavonoid antioxidants that are known to fight oxidative stress. Also, it carries mild sedative property that calms the mind and soul by regulating blood sugar and blood pressure levels (11).

[ Read: Effective Ways To Deal With Depression ]

Back To TOC

13. Innate Antiseptic Properties

Jasmine is also a favorite wound healer. No wonder then that it was used as an alternative to medicines in earlier days.

Why Does It Work

The presence of benzyl benzoate, benzoic acid, and benzaldehyde in jasmine makes it an effective antiseptic. Choose a fresh homemade oil for topical application on wounds to prevent infections. Inhalation of jasmine scent is also known to ease infections affecting the respiratory system, thwarting cold and cough (12).

Back To TOC

14. Anti-Cancerous Agent

You can even stem the growth and spread of cancerous cells with jasmine.

Why Does It Work

Numerous studies conducted on this flower suggest that it is known for its anti-cancerous and cytotoxic activities, both of which can help in easing and preventing cancer. If we look into the past, we can see that the flowers, as well as leaves of jasmine, have been used to shield women from breast cancer (13).

Back To TOC

15. Eases Spasms

Sometimes, using up different lotions and potions for painful conditions can make it worse. Why not use a single ingredient that can cure everything?

Why Does It Work

A natural antispasmodic agent, it can be used to ease painful conditions such as congestion, cough, asthma, and spasmodic cholera. It relieves spasms, alleviating the pain experienced under such conditions (14).

Back To TOC

16. Alleviates Pain And Inflammation

Suffering from a headache or a backache? Apply a drop of jasmine oil and massage. Yes, it heals, and it is a proven grandma’s home remedy for different kinds of pains and aches, including those from arthritis and rheumatism.

Why Does It Work

Jasmine, along with its anti-noci-perceptive and anti-inflammatory properties, also possesses anesthetic properties, the synergic effects of which helps in faster recovery from painful inflammatory conditions (15).

Back To TOC

17. Eases Cough And Cold

Sneezing and coughing throughout the day can reduce us into a cranky and grumpy soul. Try something new this time.

Why Does It Work

The oil extracted from jasmine flowers is a natural expectorant. This clears the phlegm accumulated in your respiratory tracts during cold and cough, giving you a good night’s sleep (16).

[ Read: Effective Home Remedies To Get Rid Of Cough ]

Back To TOC

18. Natural Remedy For Snoring

The unnatural and untimely habit of snoring can be embarrassing for you and annoying for the others too. But, did you know that Jasmine can spare you the awkward situation?

Why Does It Work

The expectorant property of this oil can be a natural cure for snoring. Sniffing the flower or oil eases the throat, widens the air passage, and keeps snoring at bay (17). Thanks to this wonderful flower, you can now have a sound sleep.

Back To TOC

19. Aids Weight Loss

Unbelievable but true, jasmine helps you lose weight.

Why Does It Work

Tender jasmine flowers are picked and infused with tea—green, black, or white. Studies suggest that intake of at least 3 cups of jasmine tea, along with a proper diet and exercise routine, can help cut unwanted flab and trim your waistline by increasing metabolism (18).

Back To TOC

20. For A Stronger Digestive System

Jasmine can improve your internal system by regulating digestive enzymes and making them effective.

Why Does It Work

Along with easing the spasms experienced during various digestive disorders, an infusion of jasmine tea is known to offer a cure for ulcers and gastritis too. It not only keeps your gut clean by paving the way for the growth of good bacteria, but it also strengthens your digestive system, developing immunity against infections (19).

Back To TOC

21. Cure For Fever

The Arabian jasmine flowers, as well as oil, have been used as a time-tested home remedy to bring down the temperature levels during a high fever.

Why Does It Work

Jasmine improves the circulation levels, eases stress, and relaxes muscles, helping in lowering and reducing fever (20).

Back To TOC

22. Improves Blood Circulation

Using jasmine can benefit you in a million other ways, especially in making your organ system fit and fine!

Why Does It Work

Jasmine, when consumed as a tea or massaged topically as oil, is known to improve blood circulation levels. It can be used to keep blood pressure levels under control and thwart off various dreaded cardiovascular conditions such as atherosclerosis, thrombosis, and strokes (21).

23. Painless Menstruation

Those five days of menses can be painful. And that makes us reach out for any possible pain-relieving options. Jasmine is one of them!

Why Does It Work

The oil extracted from Arabian Jasmine is efficient as an emmenagogue, which helps to alleviate the spasms and pain experienced during menstruation. This property also helps in regulating the cycles as well as keeping various premenstrual symptoms, including fatigue and mood swings under control. A nerve-soothing tonic, it helps women smoothly deal with this period. Mix 2 drops of jasmine oil in 1 ml sesame seed oil. Apply on your lower abs, massage gently to get over the pain (22).

Back To TOC

24. Eases Labor Pain

Now, it may sound absurd, but Jasmine is known to smoothen the delivery process.

Why Does It Work

A parturient cum uterine tonic, application of jasmine oil is known to ease the anxiety experienced during labor while helping the women relax completely. Once the muscles relax, labor becomes easier (23).

What You Need To Do

Mix 4 drops jasmine oil with 2 ml jojoba oil for more natural delivery and pain-free recovery soon after.

Back To TOC

25. Impact On Breast Milk

It’s not wrong to say that Jasmine is perfect for pregnant and lactating ladies because of the plethora of benefits it offers.

Why Does It Work

While the oil extracted from jasmine flowers is known to be a galactagogue, the flowers as such are known to be a lactifuge. Yes, Jasmine oil has been known to enhance the secretion of breast milk. Women who wish to stop breastfeeding can use jasmine flowers as it is known to halt breast milk secretion within 48 hours.

Back To TOC

26. Helps Diabetics

Among other things, jasmine can even keep your blood sugar levels under control.

Why Does It Work

Tea infused with jasmine leaves is known to maintain the blood sugar levels, normalizing the production of insulin. Consuming this tea can help people with diabetes balance their sugar levels. Studies also suggest the regular use of jasmine-infused tea to lower the chances of diabetes, especially if you are obese (24).

Back To TOC

27. Regulates Cholesterol Levels In Blood

Jasmine, when consumed as tea, is known to lower the levels of bad cholesterol in the blood. It also keeps a tab on the cholesterol levels and keeps health conditions such as heart attacks and strokes at bay.

Back To TOC

28. Other Benefits

Arabian Jasmine is also known to be therapeutic for conditions such as Leprosy, Otorrhea, Rectal bleeding, Urinary infections, Paralysis, Mental Debility, Giddiness, Liver cirrhosis and Hepatitis",,,,,,,,,,,,,,,,,,,,,,,,,,,,,,,,,,,,,,,,,,,
Jojoba Oil,Simmondsia Chinensis (Jojoba) Seed Oil,,,,Vegetable oil,Foundation,Accepted,,,,,,,,,,,,,heavy-liquid,,,,,"Jojoba is referred to as an oil, despite the fact that it is really a liquid wax.
(Oils of Nature - cf. DATA - Sources)
----------
Jojoba oil has a fatty acid profile that is almost identical to our own sebum, making it easily and quickly absorbable. Because it hydrates it can actually help calm overactive sebaceous glands that go into overdrive when skin is parched. It's an excellent emollient and helps treat irritating skin conditions such as psoriasis and eczema. Jojoba can seal in moisture and create a barrier against harsh elements and external toxins.
(argan-republic.com)",,"Fast absorption,Very penetrating",penetration enhancer,,,"anti-oxidant,protecting,skin nourishing","acne-prone skin,inflammation,oily skin,stretch marks",,,,,,Average,90,78,78 - 90,,,,,❌,,,,2-5 years,,,,,,,,,,,Jojoba Oil.jpg (https://v5.airtableusercontent.com/v3/u/28/28/1713765600000/0NxtqWctT6Yo7Gf_DtC6wg/YzjL-l0rmGgO16qeE-DceEZnZFCRYdRdQ5kmiWmBA3BdThjD8RkcPypZbalG4G51hMjKD7LZaWQr3lSVlFyJSbN3W0w7brf53UcPymouJbnwAyLuXzekVn9si5hXtd3grFrbvM02V2g6epWks597BA/h-H48ty0YQ8uH1gmwpKzEJIgZ-BzJsoRdZ2goBSBP1s),,,,,,,,,,,,,,,,,,,,,,,,,,,,,,,,,,,,,,,,,,,,,,,,
Juniper Berry EO,Juniperis communis,,,,Essential oil / CO2 / Absolute,Aromaceutical,,,,,,berries,steam distilled,"Camphoraceous,Fresh,Fruity,Green,Sweet,Woody","Top,Middle",Clear,,,,thin,,,,,,,"Medium intensity scent,Poor persistence scent",,"peace,self-worth,sincerity,strength,uplifting,vision,vitality,wisdom","apathy,burnout,confusion,depression,discouragement,indecision,low self-confidence,low self-esteem,negative thoughts,procrastination","anti-dandruff,antibacterial,antimicrobial,calming; soothing,energizing,refreshing,unclogs pores","acne-prone skin,cellulite,combination skin,congested pores,dull skin,eczema,hair - dandruff,hair loss,inflammation,irritated skin,itching,oily skin,psoriasis,varicose veins,wounds; scratches",,,,,,,,,,,,,,❌,,,Not to be used during pregnancy and lactation.,,,,,,,,,,,,Juniper Berry.jpg (https://v5.airtableusercontent.com/v3/u/28/28/1713765600000/8DKBQAlp6ucKGxYwU144vw/4cdLETCqPZBEhJOK_Fb2pwNrVTH9zKjlIfBRHlV666GOGJXaTxV7-st3xsmIi-CamSYNEtMOWXCvnLIXhqa0TjGUJHDBrm2c5k3wyXEvcJTH-67v-O6spgq8zzePI_3K_zsX3ghHYrp8FRolcAbIww/-1NCWHzIoagCsu15qqwaFFxSt3TNo4I0dkz-RTQTjAg),,,,,,,,,,,,,,,,,,,,,,,,,,,,,,,,,,,,,,,,,,Mild,Moderate,Not photosensitizing,,,,
Kaolin clay,Kaolin,,,,Adsorbents / Colourants / Bulking,Foundation,,,,,,,,,,White,,,,,,,,,"White clay, also called kaolin, is rich in silica. Its name comes from the Chinese town of Kao-Ling (land of high hills), where it was discovered. The virtues of white clay are numerous and its multiple applications, making it an essential ingredient for your cosmetic preparations. It is ideal for preparing masks and purifying and sanitizing care for dry and delicate skin.

White clay is a natural mineral of the family of phylosillicates (such as talc and micas). It is composed of hydrated aluminum silicate, its white color comes from its high percentage of alumina (about 23%), known for its repairing power. Its lamellar structure (in sheets) gives it very good covering properties .

>> Focus on absorption and adsorption:
Clays have the property of absorbing liquids such as water, filling a bit like a sponge.

Clays also have the ability to adsorb, ie to fix molecules on their surface . This ability to fix molecules comes from the fact that clays are negatively charged . The negative charge is explained by the presence of minerals (the more the clay is concentrated in mineral salts, the more it will be negatively charged ).

When the clay is in solution it will attract positive ions contrary to this solution and can exchange them once in contact with the skin. The clay will therefore participate in the remineralization and detoxification of the skin , by exchanging its mineral salts with toxins and impurities in the skin. This phenomenon allows the clay to convey assets and restore them to the skin.

The agile white is used as an ingredient in your preparations. Sedimentary clay derived from a medium leached by water on a perfectly drained ground, it is rich in silica and not very concentrated in mineral salts and is one of the least adsorbent and most hydrated clays. It is therefore used preferentially in  preparations adapted to dry and sensitive skin .

White clay has been known and used for a very long time: Paleolithic healers already treated with clay and mud. Today white clay is used in the pharmaceutical and cosmetic industries . It is also used in the manufacture of ceramics, paper, rubber and plastic.",Hydrated aluminum silicate.,,,,,"cleanser,hair cleanser,mattifier,purifying,softening","dehydrated skin,dry hair,dry skin,normal hair,oily hair,sensitive skin,normal skin",,,,,,,,,,,,,1-95%,❌,,,,,,,,,,,,,,,white kaolin clay.jpg (https://v5.airtableusercontent.com/v3/u/28/28/1713765600000/VfSpkA5MznLq1Bx5HF9EHg/9zrWWpjoLajfEtd6KmUdDVe4_RH08sNOHvEJB8ESMSl9YGhKLg50G61N-4BSVNhzyFC61KEuxU5nmftssbPprrENfaCbiuDmVBVphh4vp20/FzxxHIFl5eSvK32uozTklq1vtyuML2Pl70NwkhIRSHY),,,,☠️ Kaolin clay / 49,,,,,,,,,,,,,,,,,,,,,,,,,,,,,,,,,,France,,"Adsorbent,Absorbent",,,,,,,,
Kokum butter,Garcinia indica (Kokum) Butter,,,,Butter,Foundation,,Hard,,,,,,"Discreet,Nutty",,,,,38˚C - 41˚C,,,,,,,,"Non grainy,Non-greasy","stabiliser,thickener",,,"skin nourishing,soothing","damaged skin,dry skin","Balms that melt in quickly,Emulsions",,,,,,,,,,,,,❌,,,,,,,,,,,,,,,kokum.jpg (https://v5.airtableusercontent.com/v3/u/28/28/1713765600000/EqwAiiS4mRSX8yQCV2STNg/QvSJHVeQtlSQHsmLtsdIi4S7Kw0YCFxqSDGSMQc4BBvry-olDCoDvlnvlT68qM8YPRx40AyN6rcU2zIuEm_8SYidi6kN8HpfdLQelM9-nEo/qP729JCLcjPPkYlDlcKrcMW19Pr6Jn5xbY_IFpYlKEU),,,,,,,,,,,,,,,,,,,,,,,,,,,,,,,,,,,,,,,,,,,,,,,,
Kpangnan butter,Pentadesma Butyracea Seed Butter,,,,Butter,Foundation,,Semi soft,,,,,,,,,,,35˚C,,,,,,,,,,,,,,,,,,,,,,,,,,,❌,,,,,,,,,,,,,,,kpangnan.jpg (https://v5.airtableusercontent.com/v3/u/28/28/1713765600000/sqYypro6ArT-LkUX09YZUA/_XoFXxWGDKD3bESBPaFRo4ODROPKUk64vUmsHCCWinbbD69tp-fcpzs5z8al8G7r49eX1qcSs1LU5lgojz_ABpUKOh38aY9E4rcQyzYrP8o/9lMjZPEm7xRh52EMkbM9RolOreeZgZjbeUhpZcwmCLU),,,,,,,,,,,,,,,,,,,,,,,,,,,,,,,,,,,,,,,,,,,,,,,,
Kukui Nut Oil,Aleurites Moluccana (Kukui) Seed Oil,,,,Vegetable oil,Foundation,Accepted,,,,,seeds,,"Mild,Sweet",,"Light yellow,Clear",,clear oily liquid,,medium,0.92,188-210,,,"This oil is known to soothe sensitive skin and desquamating and useful for making care for dry feet and hands. Very penetrating, it is an excellent ingredient in detangling treatments for dry and fragile hair.

Cette huile originale provient d'un arbre originaire du pacifique : le Bancoulier.
Son fruit, ""la noix de Bancoul"" contient 2 graines âcres et dures au goût de noisette, fournissant l'huile de ""Kukui"".
Cette huile est beaucoup utilisée par les artistes peintres car c'est une huile dite ""siccative"" c'est-à-dire qu'elle possède la propriété d'accélérer le séchage des peintures à l'huile. C'est cette même propriété qui lui offre une capacité surprenante à pénétrer dans la peau et qui lui permet ainsi de réaliser des émulsions de texture légère et non grasse.
Ce toucher très sec couplé à sa composition riche en acides gras essentiels (oméga-6) lui procurent des vertus régénérantes et réparatrices hors du commun.

Des études réalisées sur cette huile ont montré qu'elle est très bien tolérée par la peau et qu'elle peut ainsi entrer dans la composition de soins pour tout type de peaux. Elle est d'ailleurs traditionnellement recommandée dans les pays asiatiques en complément des soins des peaux squameuses.
Ses propriétés calmantes proviennent notamment de son taux intéressant en oméga-3, acides gras aux effets anti-inflammatoires réputés.
En pénétrant au coeur de la fibre capillaire, l'huile végétale de Kukui s'avère un excellent ingrédient pour les soins des cheveux secs et abîmés.
(Aroma-zone)",,"Non-greasy,Very dry,Very penetrating,Very sensitive to oxidation",penetration enhancer,,,"calming; soothing,emollient,hair conditioning,hair detangler,moisturizing,regenerating,skin nourishing","damaged skin,dry hair,dry skin,feet care,hand care,mature skin,reactive skin,redness; rosacea; blemishes,scaly skin",,,,,,Fast,175,136,136 - 175,,,,,✅,,,,6-8 months,fridge,,,,,,,,,,Kukui Nut Oil.jpg (https://v5.airtableusercontent.com/v3/u/28/28/1713765600000/GLR2PHCRdSrCl_3Af9gXdA/jlgCkVs_pqYP-AXDSLmF1JTm4tdp6VQ22fKPKmGxvvAdqQn8ochwaZ_6ZyTUQK8DXIWCqq_4EG8tGryoCk144nYj6njikIuAemnqbvEKZ80ShhQcZflCjYgNuk72xfZv9-nb0ALZe6IVcRb8MbtBeQ/Vth5TzAPBbMRoFVe3hfo9I3Oz0XlupdKzVVaVPeCgk4),https://www.aroma-zone.com/info/fiche-technique/huile-vegetale-kukui-aroma-zone,,,☠️ Kukui Nut Oil / 209,,32.5,,1,,,,,,,,,,,,,,0.5,,42.5,0.5,,22.5,7,,,,5,,,0.5,,,Indonesia,,,,,,,,,,
L-Arginine,Arginine,,,,pH adjuster,Additive,Accepted,,,,,,,,,White,Solid,,,,,,,,"L-Arginine is a natural essential or semi-essential amino acid necessary for synthesis of proteins. It is used as a dietary supplement as well as in pharmaceuticals and cosmetics. Its health benefits are relatively irrelevant in hair and skin care because the concentrations we use are relatively low.

Since L-Arginine is a base (alkaline pH, the pH of a 10% solution is between 10,5-12), it is used to increase the pH of the cosmetic ingredients. It is much more milder and easier to work with NaOH (sodium hydroxide, caustic soda) or baking soda (sodium bicarbonate or sodium bicarb) and we recommend its application instead of any of them.",,,ph modifier,,,,,,,Water,,,,,,,,,,,❌,"Prepare a 10% stock solution in distilled water and use it to increase the pH of your hair and skin care products.
This is the only base you can use to increase the pH of hair conditioners made with Emulsense® HC",,,,,,,,,,,,,,,,,,,This is the only base you can use to increase the pH of hair conditioners made with Emulsense® HC,,,,,,,,,,,,,,,,,,,,,,,,,,,,,,,,,,,,,,,,,,,Increases pH
Labdanum Absolute,Cistus ladaniferus ,Cistus,,,Essential oil / CO2 / Absolute,Aromaceutical,,,,,,,,,,,,,,,,,,,,,,,,,,,,,,,,,,,,,,,,❌,,,,,,,,,,,,,,,cistus.jpg (https://v5.airtableusercontent.com/v3/u/28/28/1713765600000/I5DfYAeVtwcMhZ-waVhYxA/oLEbtLrLjT8Fg8-BzoIxmXpO-1r08o6xVkhmli3ocCFj_IDsxrMHpW-W38Ag_BXcRByULTaRCeRWsKlFnpM73pt4IOzn4qWncWFZvpc7j8M/H4DNnv8gsJMmr8pR5zenIjltDUAQIRlGI0x7RWB_W6A),,,,,,,,,,,,,,,,,,,,,,,,,,,,,,,,,,,,,,,,,,,,Not photosensitizing,,,,
