Passionfruit Oil,Passiflora Edulis (Passionfruit) Seed Oil,,,,Vegetable oil,Foundation,Accepted,,,,,,,,,Golden yellow,,,,,,,,,,,"Dry skin feel,Fast absorption,Non-greasy",,,,,,,,,,,Fast,206,196,196 - 206,,,,,✅,,,,,,,,,,,,,,,Passionfruit Oil.jpg (https://v5.airtableusercontent.com/v3/u/28/28/1713765600000/bMktz2bgRCBJyPehAi8ruQ/NxNE7037nQmpaL4xsjeUARTEHoDGWgg8-_5UfqADuJt8aj6Qty-KZHQ11TOGybQJstkRajJpCWRYBgmvb0-ZpJA6zpD45HYT_ENCXuWbrQzP9iKs5gi2F2N2Ig5ouBADAlmd-bT92Jecue9wNOTafg/QMIHtJ2RmHWnRoUN6KNdJrQHE0OxuyKdVND65IA7KPU),,,,☠️ Passionfruit Oil / 215,,,,,,,,,,,,,,,,,,,,,,,,,,,,,,,,,,Peru,,,,,,,Drying,,,
Patchouli EO,Pogostemon cablin,,,,Essential oil / CO2 / Absolute,Aromaceutical,,,,,,leaves,steam distilled,"Earthy,Musky,Sweet,Woody",Base,Amber,,,,thin-medium,,,,,,,"Good persistence scent,Medium intensity scent",,"lucidity,perseverance,vitality","agitation,anxiety,depression,disconnection,excessive thinking,fear,indecision,insecurity,instability,lethargy,mood swings,nervous tension,over sensitivity,stress,worry","anti-aging,anti-dandruff,anti-inflammatory,antibacterial,antidepressant,antifungal,antimicrobial,antiseptic,aphrodisiac,astringent,cicatrisant,deodorant,reduces wrinkles,relaxing,toning","acne-prone skin,anti-aging,cellulite,chapped skin,combination skin,congested pores,deodorant,dermatitis,dry skin,eczema,hair - dandruff,hair care,mature skin,mosquito repellent,normal skin,oily hair,oily skin,scabies,scars,skin toner,wounds; scratches,wrinkles",,,,,,,,,,,,,,❌,,,,,,,,,,,,,,,,,,,,,,,,,,,,,,,,,,,,,,,,,,,,,,,,,,,,,,,,,,,Not photosensitizing,,,,
Peach blossoms,Prunus persica,,,,Dried botanical,Active botanicals,Accepted,,,,,,,,,,,,,,,,,,,,,,,,,,,,,,,,,,,,,,,❌,,,,,,,,,,,,,,,2017-08-20 11.52.48.jpg (https://v5.airtableusercontent.com/v3/u/28/28/1713765600000/syQaRuIIUhjJTe0hfM5C4w/kv1ifL72MMufjs44lBVtnHRqeX8MMBpUyMMjkc-s7cDCuQObGDm9NtZfQbmN9ZlD6F3nLpsWoW1lBeXwko9rWzJRzwoz5utxhtatRFVuuNw/tkx8U4y1LFzTfEwlfSoWomfc-mkamOxsnz6eSHJtWtE),,,,,"• Provide Protein & Vitamins A, B, & C 
• Ease Constipation
• Remove Body Toxins 
• Promote Skin Health
• Treat Endocrine Disorders
• Reduce Body Fats
• Regulate the Female Cycle
• Improve Blood Circulation
• Lighten Freckles & Wrinkles
• Acne
• Moisturize Skin
• Relieve Clogged Skin Pores
• Cleanse the Intestines

* Organic - Decaffeinated - Import from China

* Potent in flavor - this flower is vigorous in flavor and strength - relaxing into a mild floral taste

* NOT For Pregnancy",,,,,,,,,,,,,,,,,,,,,,,,,,,,,,,,,,,,,,,,,,,
Pentylene glycol,Pentylene glycol,,,,Humectant,Functional,Accepted,,,,,,,,,Clear,Liquid,,,,,,,,"Glycols are known to be excellent moisturizers, solvents and antimicrobial ingredients (preservative boosters). They have a better dissolving power and less stickiness compared to glycerine. The problem is, they were considered as cheap solvents derived from mineral oil and were hence a no-go in natural & organic comsetics.

Since a few years however, plant based glycols, derived from sugar cane and corn are available and are getting more and more popular in the green cosmetic industry. These excellent humectants could be applied in all leave-on and rinse-off hair & skin care products. Glycold improve the stability of water based products at lower temperatures (well, mineral oil based propylene glycol is the well known anti-freeze agent used in winter in automobiles). We recommend this ingredient to be applied whenever you don't like the stickiness of glycerine but fat beyond that, we recommend this ingredient to be applied in ""micellar waters"" for creating stable, transparent and natural micellar waters. The low dosage of the ingredient justifies its hight price.",,"Dissolves well,Non-sticky","enhances stability in water-based products,humectant,moisturising,solvent,strong antimicrobial activity,transparency in micellar waters",,,"antimicrobial,moisturizing",,"Leave-on,Rinse-off,Hair care,Skin care,Micellar water",,Water,,,,,,,,,,0.5-5% (in micellar waters 2-4%),❌,,,,,,,,Glycerin,,,,,,,,https://skinchakra.eu/blog/archives/434-How-to-make-natural-micellar-waters-Elderflower-micellar-water.html,,,,,,,,,,,,,,,,,,,,,,,,,,,,,,,,,,,,,,,,,,,,,,,
Pepper (Black) EO,Piper nigrum,,,,Essential oil / CO2 / Absolute,Aromaceutical,,,,,,fruit,steam distilled,,"Top,Middle",,,,,,,,,,,,,,"comfort,motivation,security","anger,apathy,confusion,emotional coldness,emotional frustration,exhaustion,fatigue,indecision","muscle toning,promotes blood circulation",muscle aches,,,,,,,,,,,,,Not to be used in facial skincare.,❌,,,"Not to be used during pregnancy and lactation.
Not to be used in facial skincare.",,,,,,,,,,,,,,,,,,,,,,,,,,,,,,,,,,,,,,,,,,,,,,,,,,,,,,,Moderate,Not photosensitizing,,,,
Peppermint EO,Mentha piperita,,,,Essential oil / CO2 / Absolute,Aromaceutical,,,,,,whole plant,steam distilled,"Fresh,Herbaceous,Minty,Peppery,Sweet","Top,Middle",Clear,,,,thin,,,,,,,"High intensity scent,Poor persistence scent",,"acceptance,alertness,concentration,mental clarity,vitality","apathy,confusion,distraction,fatigue,indecision,lack of concentration,lethargy,low self-confidence,low self-esteem,mood swings,overwork,poor short-term memory,shock","analgesic,anti-inflammatory,antibacterial,antifungal,antiviral,cooling,insect repellent,invigorating,reduces inflammation,stimulating","acne-prone skin,athlete's foot,burns,candida infections,cold sores,combination skin,dermatitis,dull skin,herpes,inflammation,insect bites,itching,muscle aches,oily skin",,,,,,,,,,,,,,❌,,,Not to be used during pregnancy and lactation.,,,,,,,,,,,,,,,,,,,,,,,,,,,,,,,,,,,,,,,,,,,,,,,,,,,,,,Mild,,Not photosensitizing,,,,
Perilla Seed Oil,Perilla Frutescens (Perilla) Seed Oil,,,,Vegetable oil,Foundation,Accepted,,,,,,,"Light,Nutty,Sweet",,Golden yellow,,,,light,,,,,,,"Fast absorption,Non-greasy,Silky feel",,,,"anti-inflammatory,anti-oxidant,antibacterial,antifungal,calming; soothing,emollient,improves skin elasticity,moisturizing,protecting,regenerating,relieves itchy skin,skin hydration,skin toner,soothes irritation,soothing","acne-prone skin,dehydrated skin,dry skin,itching,mature skin,premature aging,reactive skin,sensitive skin",,,,,,Fast,,,,,,,,❌,,,,,,,,,,,,,,,Perilla Seed Oil.jpg (https://v5.airtableusercontent.com/v3/u/28/28/1713765600000/HKrHedK30qGP1btzS772NA/JGwtO55-GJ-53i6i3ix6dlYSjCaMcXx0mP_DrEswCObpQk69WCqAn9XWPmpewhtIbZikzA9ZIengcl9kLzWLvKApE5DNLdhWv1-0WaDaeozO3jOBfjHohs6VOZHF-Y219-zWCqPdzly8GnV9UlzoeQ/B7c3TZn57ISJBPNwteQvxue7lihFLaS6_VfyNfdSbCw),,,,☠️ Perilla Seed Oil / 245,,55,,,,,,,,,,,,,,,,,,15,,,17.5,6,0.5,,,2,,,,,,China,,,,,,,Drying,,,
Peru Balsam,Myroxylon balsamum var. pereirae,,,,Essential oil / CO2 / Absolute,Aromaceutical,,,,,,resin,steam distilled,,Base,,,,,,,,,,,,,,,,,,,,,,,,,,,,,,,❌,,,,,,,,,,,,,,,,,,,,,,,,,,,,,,,,,,,,,,,,,,,,,,,,,,,,,,,,,,Moderate,Not photosensitizing,,,,
Petitgrain EO,Citrus aurantium,,,,Essential oil / CO2 / Absolute,Aromaceutical,,,,,,"leaves,twigs",steam distilled,"Citrusy,Floral,Green,Peppery,Tobacco,Woody",Middle,Clear,,,,thin-medium,,,,,,,,,"balance,emotional clarity,harmony,joy,optimism,relaxation,self-confidence,stability,strength,vitality","anger,anxiety,confusion,depression,exhaustion,fatigue,insomnia,introversion,nervous tension,pessimism,rigidity,sadness,stress","anti-inflammatory,cleanser,deodorant,refreshing,toning","acne-prone skin,combination skin,deodorant,dull skin,mature skin,oily skin,premature aging,skin toner",,,,,,,,,,,,,,❌,,,,2-3 years,,,,,,,,,,,,,,,,,,,,,,,,,,,,,,,,,,,,,,,,,,,,,,,,,,,,,,,Not photosensitizing,,,,
Pine (Pinyon) EO,Pinus edulis (Pinion Pine) Essential Oil,,,,Essential oil / CO2 / Absolute,Aromaceutical,,,,,,,,,,,,,,,,,,,,,,,,,,,,,,,,,,,,,,,,❌,,,,,,,,,,,,,,,,,,,,,,,,,,,,,,,,,,,,,,,,,,,,,,,,,,,,,,,,,,Moderate,Not photosensitizing,,,,
Pine (Scotch) EO,Pinus sylvestris,,,,Essential oil / CO2 / Absolute,Aromaceutical,,,,,,needles,steam distilled,"Camphoraceous,Earthy,Fresh,Resinous,Woody",Top,Clear,,,,thin,,,,,,,,,"acceptance,direction,mental clarity,patience,perseverance,self-forgiveness,sharp thinking,trust,understanding","exhaustion,feeling of rejection,guilt,self-criticism,worry","antibacterial,invigorating","acne-prone skin,cuts,oily skin",,,,,,,,,,,,,,❌,,,,,,,,,,,,,,,,,,,,,,,,,,,,,,,,,,,,,,,,,,,,,,,,,,,,,,,,,,Moderate,Not photosensitizing,,,,
Plantapon® SF ,Aqua (and) Sodium Cocoamphoacetate (and) Glycerin (and) Lauryl Glucoside (and) Sodium Cocoyl Glutamate (and) Sodium Lauryl Glucose Carboxylate,,,,Surfactant,Functional,Accepted,,,Surfactant,,,,Mild,,Clear,Liquid,,,,,,,,,Water content of 48.0-58.0%.,,,,,,,"Shampoo,Shower gel",,Water,,,,,,,6.5-7.5,,,,❌,,,,,,,Coco-glucoside and glyceryl oleate,,,,,,,,,,,,,,,,,,,,,,,,,,,,,,,,,,,,,,,,,,,,,,,,,,,,,,,,
Plantaserve M,Benzyl Alcohol (and) Salicylic Acid (and) Glycerin (and) Sorbic Acid,,"Mikrokill ECT,Preservative Eco,Geogard ECT",,Preservative,Additive,Accepted,,,,,,,,,,,,,,,,,,,,,,,,,,,,,,,,,,,,,less than 5.5,1% - 1.1% (max. 1.15%),❌,Cool down phase.,,Over time benzyl alcohol oxidises to benzaldehdye resulting in an almond odour. ,,,,,,,,,,,,,,,,,,,,,,,,,,,,,,,,,,,,,,,,,,,,,,,,,,,,,,,,,,,,
Polawax,Cetearyl Alcohol (and) Glyceryl Stearate and PEG-40 Stearate (and) Ceteareth-20,,,,Surfactant,Functional,Not accepted,,,Emulsifier,,,,,,,,,,,,,,,,,,,,,,,,,,,,,,,,,,,,❌,,checked,,,,,BTMS-50,,,,,,,,,,,,,,,,,,,,,,,,,,,,,,,,,,,,,,,,,,,,,,,,,,,,,,,,
Pomegranate Seed Oil,Punica Granatum (Pomegranate) Seed Oil,,,,Vegetable oil,Foundation,Accepted,,,,,,,,,,,,,,,,,,,,,,,,,,,,,,,,250,210,210 - 250,,,,,✅,,,,,,,,,,,,,,,Pomegranate Seed Oil.jpg (https://v5.airtableusercontent.com/v3/u/28/28/1713765600000/m0PH45fr_zX98LOnrHrKUg/WqFN7JA9191v7b-LyJNgpWYqdw8MPoyayPKkgdeQDmMHZIhVyDeZ5KU6GX9NiGDowuhVQhB-iX6iXHFH1i_F6TD8Z-pq-kjiUR5S-1eHZtsH2JR_1OeJsFzeh9YEicB0hFaS5nf3sLGBYjTlG1f41ziwRvg1-CMJeimjz3Wy1E8/b6lJ_qd3oTwmA0ASJ5-jYQJL2iuQv3BA87jMK177Sg8),,,,,,,,,,,,,,,,,,,,,,,,,,,,,,,,,,,,Punicic Acid,,,,,,,,,,,,
Potassium Sorbate,Potassium Sorbate,,,,Preservative,Additive,Accepted,,,,,,,,,,,,,,,,,,,,,,,,,,,,,,,,,,,,,,,❌,,,,,,,,,,,,,,,,,,,,,,,,,,,,,,,,,,,,,,,,,,,,,,,,,,,,,,,,,,,,,,,
Pracaxi Oil,Pentaclethra Macroloba (Pracaxi) Seed Oil,,,,Vegetable oil,Foundation,Accepted,,,,,seeds,cold pressed,Roasted nuts,,"Yellow,Brown yellow",,"Oily liquid, can be cloudy and partially crystallize at room temperature.",18.5,medium,0.92,170-180,3,,"Extracted from the pods of the Pracaxi tree in the Amazon Jungle, Pracaxi oil is called ""miracle oil"" for its high ability rebuild the skin tissue, Pracaxi oil is one of the highest sources of Behenic acid of all plants known.
It also possesses powerful antibacterial, antifungal and antiseptic properties and helps alleviate redness and itching, making it perfect for irritated and blemished skin.
Not well known outside the Amazon forest region, Pracaxi oil is one of the most extraordinary ingredients we have been blessed to know.
With its extraordinary capacity of cell renewal Pracaxi oil has became a highly prized ingredient in skin care formulations intended to fight skin aging.
The oil is effective for stretch marks, fever blisters, speeding wound healing as well as for combating hyper-pigmentation caused by skin rupture and hormonal imbalance, treatment of skin spots, severe acne, wrinkles and scars.
When applied to the hair, Pracaxi oil helps moisturize, soften and smooth the hair and promotes shine besides helping to avoid hair loss.

Pracaxi has sparked the interest of scientists and formulators of natural body care products in South America. In the Amazon region it is used for skin spots, and scars. The Indians also use a tea made from the bark on their bodies after bathing and then sun dry themselves. This forms a thin film covering their bodies believed to help fight the effects of aging. It is also used by the Indians to stop bleeding. In a clinical study researchers reported that it demonstrated strong antifungal activity in vitro against 11 common skin fungi and yeasts.
 
---
Seed oil of P. macroloba is used in cosmetic industry and may have positive effects on wound healing.92
The oil is known to have the highest content of behenic acid, C21H43COOH, in natural products (10-25%),51 while most fruits or nuts contain less than 1%.27,48 Besides, the saponin (104) isolated from the seeds exhibited high larvicidal activity with LC50 = 18.6 μg mL-1.

----
Pracaxi oil is an extraordinary oil with several cosmetic, therapeutic and medicinal properties.  

It is widely used on the treatment of hyperpigmentation and scars besides improving the appearance of stretch marks, it acts as an inhibitor of melanin biosynthesis, being used on the treatment of melasma and sun and age spots (with Acai, Brazil Nut, Pataua and Tucuma Oils)

It is often used to treat erysipelas, a skin infection usually caused by bacteria. In the forest it is used to treat snake and scorpion bites and as a mosquito repellent.

Pracaxi is very popular for treating hair, it makes it brighter, easier to comb, and helps to avoid hair loss.

No wonder Pracaxi has been commonly referred as “The Miracle Oil” !!

PROPERTIES:

Strong antibacterial, antiseptic, antifungal,  anti-parasitic and anti hemorrhagic

Highest source of Behenic acid (6 times higher than that of peanut oil) 

Strong moisturizing properties, easy to use, absorbs fast

Inhibitor of melanin biosynthesis (used on the treatment of melasma and sun and age spots

APPLICATIONS:

Scars

Melasma

Age and sun spots

Stretch marks

Erysipelas (skin infection usually caused by bacteria)

Hair loss

Dull hair
(Rain Forest Chica)
",,"Fast absorption,Good absorption,Natural alternative to BTMS,Non-greasy,Silky feel",,,,"antibacterial,antifungal,antiseptic,conditioning,draws curls,fights hair loss,hair conditioning,hair detangler,hair frizz control,hair lustre,hair nourishing,hair softener and smoother,hydrating,hyperpigmentation; skin lightener,improves hair manageability,improves hair strength,""increases hair elasticity, manageability and shine"",moisturizing,mosquito repellent,prevents scarring,regenerating,skin softner","acne-prone skin,add shine to hair,age spots,chapped lips,colored hair,curly hair,dry hair,dull hair,eye contour,hair care,hair loss,hair shine,helps prevent split ends,hyperpigmentation,mature skin,mosquito repellent,premature aging,scars,skin with imperfections,split ends repair,stretch marks,sun damage",,,,,,Fast,105,90,90 - 105,,,,,✅,,,,,,,,,,,,,,,Pracaxi Oil.jpg (https://v5.airtableusercontent.com/v3/u/28/28/1713765600000/D7hiUDywI9IylcMt3L6rpQ/UisGbgLpPtxFXm6LBuGJLrigUw6Iam334IkA5jfMNdXgILRjhjodyzYvfpe1Dw3_IIaYdUYl5jdOn2VjbBz_DtQtgWemOi4zb360zj8ZOJyehiHXoIT-svhwxECieYw4kk-ITyxXsVzTw6XFr9M5Tw/jZvzRbnJroVqCgDNAqxKrmWDigyPHZj7d-7bsmJpmAc),,,,☠️ Pracaxi Oil / 216,,2.3,,,19.67,,,,,,,,,,,,,1.3,14.8,1.96,1.21,,44.32,2.04,,,,2.14,,,,,,Brazil,,,,,,,,,,
Preservative Eco,"Benzyl Alcohol, Salicylic Acid, Glycerin, Sorbic Acid",,"Geogard ECT,Plantaserve M,Mikrokill ECT",,Preservative,Additive,Accepted,,,,,,,,,,,,,,,,,,"An effective and simple to use preservative that is palm free and comes with good eco credentials so that it can be used in natural and organic products.
A clear, colourless to slightly straw coloured mobile liquid with a slight odour which becomes stronger if the preservative is added as the last ingredient in a product. We recommend to blend the Stage 3 (below 40°C) ingredients together before adding to the product. This way, the preservative has a very low odour profile.

An unique combination of benzyl alcohol, salicylic acid, glycerin and sorbic acid. This antimicrobial blend offers broad spectrum protection against Gram-positive and Gram-negative bacteria, yeast and moulds. It has a wide range of global regulatory acceptance.

The Glycerine is Palm Free and is sourced from Canola or Soy Bean Oil.

NOTE: As this preservative contains Salicylic acid, it cannot be used in leave on products (like creams) intended for babies and children. It can be used in rinse off products like a shampoo or body wash.",,,,,,,,,,"""Part oil, part water""",,,,,,,,,less than 5.5,1% - 1.1% (max. 1.15%),❌,Cool down phase.,,Over time benzyl alcohol oxidises to benzaldehdye resulting in an almond odour. ,,,,,,,,,,,,,https://skinchakra.eu/blog/archives/555-Whats-the-matter-with-benzy-alcohol.html,https://www.aromantic.co.uk/home/products/preservatives/preservative-eco-plus.aspx,,,,,,,,,,,,,,,,,,,,,,,,,,,,,,,,,,,,,,,,,,,,,,
Preservative K,"Benzyl alcohol, Phenoxyethanol, Potassium sorbate, Aqua, Tocopherol",,,,Preservative,Additive,Not accepted,,Broad spectrum,,,,,Slight,,Pale yellow,,,,,,,,,Leave on and rinse off products,,,,,,,,,,"Partially soluble in water,Glycerin",,< 80oC (add to stage 3 at < 40oC),,,,,,,less than 5.5,1 - 1.5%,❌,Cool down phase.,,Over time benzyl alcohol oxidises to benzaldehdye resulting in an almond odour. ,,,,,,,,,,,,,https://www.aromantic.co.uk/home/products/preservatives/preservative-k.aspx,,,,,,,,,,,,,,,,,,,,,,,,,,,,,,,,,,,,,,,,,,,,,,,
Prickly Pear Seed Oil,Opuntia Ficus Indica (Prickly Pear) Seed Oil,,,,Vegetable oil,Foundation,Accepted,,,,,,,,,,,,,,,,,,,,,,,,,,,,,,,,130,100,100 - 130,,,,,✅,,,,,,,,,,,,,,,Prickly Pear Seed Oil.jpg (https://v5.airtableusercontent.com/v3/u/28/28/1713765600000/TWSAovdH0g_a7fZf5nMByA/0vCSEq7gAW6v3qiVWme2vJVVFoAKVvM3cYLSTHr_Sfy5r2iBW16oTGwPaJVSSWmYNOXmscCgtWFHEbJ8lpP-3ngLI6zv7F_1s02q-W1CBaXerF7LjrZBV467UPb9n49YZK2LpkdKaZdmd-hIdJSqT525U_3C8IatAM8W9pMwIPk/lnjv9lJjJH_qw8xxZGvDHCdn0RhQ0j2fjgVUXSgKs18),,,,☠️ Prickly Pear Seed Oil / 217,,1,,,,,,,,,,,,,,,,,,60,,,20,12,1,,,4,,,,,,Morocco,,,,,,,,,,
Propanediol 1.3,Propanediol,,,,Humectant,Functional,Accepted,,,,,,,,,Clear,,,,,,,,,"Propanediol 1,3 (referred to as Propanediol hereafter) is a natural, green, propylene glycol alternative derived from corn sugar, used as a humectant, hair and skin conditioner, preservative booster, and solvent with a light, non-sticky, slightly dry skin feel. 

Propanediol may boost the efficacy of preservatives. Its efficacy was demonstrated when combined with preservatives containing phenoxyethanol against yeast, gram-positive, and gram-negative organisms, as well as mold.

0.25% Euxyl PE 9010 and 2% Propanediol proved effective against Pseudomonas aeruginosa (bacteria) and Aspergillus niger (mold), as well as at 4% against Staphylococcus aureus and Escherichia coli (bacteria) and 6% against Candida albicans (yeast).
Similar results were shown using 0.25% Optiphen with 2% against Staphylococcus aureus (gram-positive bacteria), Escherichia coli (gram-negative bacteria), and Aspergillus niger (mold), and Candida albicans (yeast) at 6%.
Reduced levels of Optiphen at 0.125% and 6% Propanediol were also shown to be effective.",,"Light skin feel,Non-greasy,Slightly dry","humectant,penetration enhancer,preservative booster,solvent",,,"emollient,hair and skin conditioner,moisturizing",,,,Water,,,,,,,,,,"1 - 10%, up to 20% ",❌,,,," 2 Years can be expected, if seal is unbroken and stored as directed, otherwise ~ 9 -12 months ",,,,,,"Euxyl PE 9010,Optiphen",,,,,,https://www.lotioncrafter.com/propanediol-1-3.html,,,☠️ Propanediol 1.3 / 168,,,,,,,,,,,,,,,,,,,,,,,,,,,,,,,,,,,,,,,,,,,,
Provitamin B5 - Panthenol (Powder),Panthenol,,,16485-10-2,"Humectant,Vitamin",Functional,Accepted,,,,,,,,,White,Solid,White crystalline powder,,,,,,,Humectant and wound and cut healer,,,humectant,,,"anti-inflammatory,hair moisturising,hair shine,hydrating,improvement of hair structure,improves barrier properties of the skin,improves skin elasticity,moisturizing,reduction in transepidermal water loss,relieves dry skin,relieves itchy skin,skin hydration,skin softner,skin toner,soothes irritation","dehydrated skin,dry skin,inflammation,redness; rosacea; blemishes,scaly skin,wounds; scratches",,,Water,,,,,,,,,,1-5% ,❌,Add to the heated water phase.,,,,room temperature,,,,,,,,,,,http://www.lotioncrafter.com/dl_panthenol.html,,,☠️ Provitamin B5 - Panthenol (Powder) / 242,,,,,,,,,,,,,,,,,,,,,,,,,,,,,,,,,,China,,,,,,,,,,
Provitamin B5 - Panthenol (Solution),Panthenol,Pro-Vitamin B5 (Aroma-Zone),,,"Humectant,Vitamin",Functional,Accepted,,,,,,,,,Clear,Liquid,White crystalline powder,,,,,,,"Humectant and wound and cut healer. 75% D-Panthenol, in solution in water. Colorless viscous liquid.
",,,humectant,,,"anti-inflammatory,hair moisturising,hair shine,hydrating,improvement of hair structure,improves barrier properties of the skin,improves skin elasticity,moisturizing,reduction in transepidermal water loss,relieves dry skin,relieves itchy skin,skin hydration,skin softner,skin toner,soothes irritation","dehydrated skin,dry skin,inflammation,redness; rosacea; blemishes,scaly skin,wounds; scratches",,,Water,,,,,,,,,,1-5% ,❌,Add to the cool down phase.,,,,room temperature,,,,,,,,,,,https://www.aroma-zone.com/info/fiche-technique/actif-cosmetique-provitamine-b5-aroma-zone,,,☠️ Provitamin B5 - Panthenol (Solution) / 293,,,,,,,,,,,,,,,,,,,,,,,,,,,,,,,,,,,,,,,,,,,,
Pumpkin Seed Oil,Cucurbita Pepo (Pumpkin) Seed Oil,,,,Vegetable oil,Foundation,Accepted,,,,,,,,,,,,,,,,,,,,,,,,,,,,,,,,134,113,113 - 134,,,,,✅,,,,,,,,,,,,,,,Pumpkin Seed Oil.jpg (https://v5.airtableusercontent.com/v3/u/28/28/1713765600000/zdioE5YaC9-EtUOpR-8YpA/gS6FbPFkV2Yk_-cIK89MR66y5Ql7rPOi6cfOSrBO5UcacZjWYuXF0JoS7c-cr3Bp-KI6up4vPN6ZY0oyk27ls9a3vAblVl5ZFxqmgSYwwd1cjZ49l24fwcKaU3i1tzfFbA9aVJjz4n8HIxekgVRQjA/P30GNARqHa_ydKJzPycKWoXF61CkJifsIsgAm-6_PW8),,,,,,,,,,,,,,,,,,,,,,,,,,,,,,,,,,,,,,,,,,,,,,,,
Ravensara EO,Ravensara aromatica,,,,Essential oil / CO2 / Absolute,Aromaceutical,,,,,,leaves,steam distilled,,,,,,,,,,,,,,,,,,,,,,,,,,,,,,,,,❌,,,,,,,,,,,,,,,,,,,,,,,,,,,,,,,,,,,,,,,,,,,,,,,,,,,,,,,,,,,Not photosensitizing,,,,
Ravintsara (Ho Leaf) EO,"Cinnamomum camphora ct. 1,8 cineole",,,,Essential oil / CO2 / Absolute,Aromaceutical,,,,,,leaves,steam distilled,"Fresh,Medicinal,Spicy,Sweet",Middle,Clear,,,,thin,,,,,,,"High intensity scent,Poor persistence scent",,,"anxiety,apathy,depression,fatigue,grief,indecision,insecurity,insomnia,lack of concentration,low self-confidence,low self-esteem,poor short-term memory,procrastination","analgesic,antibacterial,antiseptic,antiviral","cold sores,cuts,herpes,wounds; scratches",,,,,,,,,,,,,,❌,,,Not to be used during pregnancy and lactation.,,,,,,,,,,,,,,,,,,,,,,,,,,,,,,,,,,,,,,,,,,,,,,,,,,,,,,,,Not photosensitizing,,,,
French red clay,Kaolin,,,,Adsorbents / Colourants / Bulking,Foundation,,,,,,,,,,"Red,Orange-brown",,,,,,,,,"Red clay has been used for a long time by women for their beauty treatments and to make their makeup. This clay rich in iron oxide restores brightness to scrambled complexions and reduces small redness. Its stimulating bright red color will brighten up your beauty treatments. It is ideal in your mask preparations to detoxify and revive dull skin, or to color your soaps. Our superfine red clay is extracted from natural quarries in France and simply dried to preserve all the wealth of minerals and properties and crushed into ultrafine powder for easy and enjoyable application.",Hydrated aluminum silicate,,,,,"cleanser,detoxifying,mattifier,purifying,skin radiance,skin toner,stimulating,very drying,firming","normal skin,oily skin,mature skin",,,,,,,,,,,,,,❌,,,,,,,,,,,,,,,red clay.jpg (https://v5.airtableusercontent.com/v3/u/28/28/1713765600000/x6FMnJEgVW-pKtm_cZlnYg/0weGruMZemhJ0wARqxpykUqgNFH_6f0RPmnUIvfXA71KSb-Uhg5OGYHZPRETtKrzfZJOrVjx_bp2QMgxTzGyPojQdGBpiFsUN-u2FHFzWow/TX2g8GUdLz-XPg6fSXqdPlF0VEuR5YyZT-SyD3Cojug),,,,,,,,,,,,,,,,,,,,,,,,,,,,,,,,,,,,,,,,"Adsorbent,Absorbent",,,,,,,,
